{
  "schema_version": "1.0",
  "timestamp": "2026-10-06T14:35:22Z",
  "config_version": 2,
  "values": {
    "config_version": 2,
    "timezone": "UTC",
    "launcher.auto_restart": true,
    "launcher.max_restart_attempts": 10,
    "launcher.backoff_seconds": [
      5,
      15,
      45,
      120,
      300
    ],
    "launcher.reset_on_scheduled_restart": true,
    "orchestrator.scheduled_restart_enabled": false,
    "orchestrator.scheduled_restart_transitions": 20,
    "orchestrator.scheduled_restart_hours": 1,
    "orchestrator.context.refresh_interval_iterations": 10,
    "orchestrator.context.refresh_files": [
      "AGENTS.md",
      "skills/orchestrator/SKILL.md"
    ],
    "slots.max": 1,
    "slots.pause_threshold": 2,
    "slots.pause_threshold_min": 1,
    "slots.pause_threshold_max": 5,
    "roles.definer.default_thinking": "high",
    "roles.definer.max_retries": 3,
    "roles.definer.timeout_minutes": 30,
    "roles.builder.default_thinking": "high",
    "roles.builder.max_retries": 5,
    "roles.builder.timeout_minutes": 60,
    "roles.verifier.default_thinking": "low",
    "roles.verifier.max_retries": 3,
    "roles.verifier.timeout_minutes": 30,
    "heartbeat.interval_seconds": 120,
    "heartbeat.stale_minutes": 10,
    "heartbeat.force_release_multiplier": 2,
    "schema.strict": true,
    "schema.max_retries": 3,
    "schema.validator_timeout_seconds": 10,
    "merge.dry_run": true,
    "merge.full_suite_every": 10,
    "merge.fast_path_lines": 10,
    "merge.commit_message_max": 5000,
    "merge.transactional": true,
    "merge.smoke_tests_min": 10,
    "merge.smoke_tests_max": 20,
    "git.push_retry": 3,
    "git.push_backoff_seconds": [
      5,
      15,
      45
    ],
    "git.merge_fix_max_level": 3,
    "git.force_push_check": true,
    "git.worktree_retry": 3,
    "git.worktree_lock_backoff_seconds": 5,
    "git.main_history_track": true,
    "git.require_gpg": false,
    "git.autocrlf_uniform": true,
    "memory.read_max": 3,
    "memory.promote_count": 2,
    "memory.fail_delete_threshold": 3,
    "memory.write_after_failures": 3,
    "memory.pattern_threshold": 3,
    "memory.similarity_dedupe": 0.85,
    "memory.max_size_kb": 10,
    "memory.max_candidates": 100,
    "memory.retention_days": 90,
    "memory.verified_retention_days": 365,
    "failure_patterns.enabled": true,
    "failure_patterns.similarity_threshold": 0.8,
    "failure_patterns.min_occurrences": 3,
    "contract_first.enabled": true,
    "contract_first.require_for": [
      "backend",
      "api",
      "database"
    ],
    "contract_first.allow_natural_for": [
      "ui",
      "ux"
    ],
    "output.externalize_lines": 50,
    "output.externalize_tokens": 1000,
    "output.request_max_lines": 500,
    "output.diff_split_lines": 2000,
    "log.tail_lines": 100,
    "log.line_max_chars": 500,
    "log.rotation_time_utc": "00:05",
    "log.dual_format_daily": true,
    "log.compress_after_days": 7,
    "log.monthly_after_days": 30,
    "log.quarterly_after_days": 365,
    "log.report_delay_hours": 12,
    "log.structured_wal": true,
    "retention.output_keep_days": 7,
    "retention.output_archive_days": 30,
    "retention.log_keep_days": 90,
    "retention.daily_log_days": 30,
    "retention.monthly_summary_days": 90,
    "retention.quarterly_archive_days": 365,
    "retention.config_history_keep": 10,
    "retention.approval_keep_days": 30,
    "retention.merge_history_days": 0,
    "retention.failure_audit_days": 0,
    "retention.metrics_days": 180,
    "retention.status_metrics_days": 30,
    "retention.idempotency_days": 7,
    "limits.dep_chain_warn": 10,
    "limits.dep_chain_halt": 20,
    "limits.comments_keep": 5,
    "limits.history_max_lines": 1000,
    "limits.pending_stale_days": 7,
    "limits.stale_block_days": 7,
    "limits.blocker_fatigue_count": 5,
    "limits.approval_delete_files": 1,
    "limits.approval_issue_count": 10,
    "limits.similarity_threshold": 0.8,
    "limits.ac_change_blocker_pct": 50,
    "limits.analysis_max_per_day": 5,
    "limits.issue_granularity.max_acs": 4,
    "limits.issue_granularity.max_files": 2,
    "limits.issue_granularity.max_diff_lines": 200,
    "limits.issue_granularity.warn_only": true,
    "priority.human_override_max": 3,
    "priority.boost_value": 100,
    "priority.starvation_warn_hours": 24,
    "priority.starvation_blocker_hours": 48,
    "human_review.stale_days": 7,
    "human_review.poll_interval_iterations": 1,
    "human_review.auto_close_after_days": 30,
    "approval.mode": "full-auto",
    "approval.warn_hours": 24,
    "approval.max_hours": 72,
    "approval.pre_authorized": [],
    "automation.auto_recovery.enabled": true,
    "automation.auto_recovery.level": 4,
    "automation.auto_recovery.max_consecutive_failures": 5,
    "automation.auto_skip_blocked": true,
    "automation.auto_learn": true,
    "automation.stall_detection.enabled": true,
    "automation.stall_detection.iterations_threshold": 10,
    "automation.stall_detection.action": "write_report",
    "automation.infinite_loop_detection.enabled": true,
    "automation.infinite_loop_detection.max_same_failure": 5,
    "disk.warn_mb": 1000,
    "disk.halt_mb": 100,
    "disk.force_archive_mb": 500,
    "disk.archive_free_ratio": 2,
    "api.page_size": 100,
    "api.cache_ttl_minutes": 5,
    "api.cache_force_on_error": true,
    "api.confirm_retries": 2,
    "api.confirm_gap_seconds": 5,
    "platform": "github",
    "api_token": "****REDACTED****",
    "repo_id": "https://github.com/HsiChinHuang/table-queue.git"
  },
  "sources": {
    "config_version": "yaml",
    "timezone": "yaml",
    "launcher.auto_restart": "yaml",
    "launcher.max_restart_attempts": "yaml",
    "launcher.backoff_seconds": "yaml",
    "launcher.reset_on_scheduled_restart": "yaml",
    "orchestrator.scheduled_restart_enabled": "yaml",
    "orchestrator.scheduled_restart_transitions": "env",
    "orchestrator.scheduled_restart_hours": "env",
    "orchestrator.context.refresh_interval_iterations": "yaml",
    "orchestrator.context.refresh_files": "yaml",
    "slots.max": "env",
    "slots.pause_threshold": "yaml",
    "slots.pause_threshold_min": "yaml",
    "slots.pause_threshold_max": "yaml",
    "roles.definer.default_thinking": "yaml",
    "roles.definer.max_retries": "yaml",
    "roles.definer.timeout_minutes": "yaml",
    "roles.builder.default_thinking": "yaml",
    "roles.builder.max_retries": "yaml",
    "roles.builder.timeout_minutes": "yaml",
    "roles.verifier.default_thinking": "yaml",
    "roles.verifier.max_retries": "yaml",
    "roles.verifier.timeout_minutes": "yaml",
    "heartbeat.interval_seconds": "yaml",
    "heartbeat.stale_minutes": "yaml",
    "heartbeat.force_release_multiplier": "yaml",
    "schema.strict": "yaml",
    "schema.max_retries": "yaml",
    "schema.validator_timeout_seconds": "yaml",
    "merge.dry_run": "yaml",
    "merge.full_suite_every": "yaml",
    "merge.fast_path_lines": "yaml",
    "merge.commit_message_max": "yaml",
    "merge.transactional": "yaml",
    "merge.smoke_tests_min": "yaml",
    "merge.smoke_tests_max": "yaml",
    "git.push_retry": "yaml",
    "git.push_backoff_seconds": "yaml",
    "git.merge_fix_max_level": "yaml",
    "git.force_push_check": "yaml",
    "git.worktree_retry": "yaml",
    "git.worktree_lock_backoff_seconds": "yaml",
    "git.main_history_track": "yaml",
    "git.require_gpg": "yaml",
    "git.autocrlf_uniform": "yaml",
    "memory.read_max": "yaml",
    "memory.promote_count": "yaml",
    "memory.fail_delete_threshold": "yaml",
    "memory.write_after_failures": "yaml",
    "memory.pattern_threshold": "yaml",
    "memory.similarity_dedupe": "yaml",
    "memory.max_size_kb": "yaml",
    "memory.max_candidates": "yaml",
    "memory.retention_days": "yaml",
    "memory.verified_retention_days": "yaml",
    "failure_patterns.enabled": "yaml",
    "failure_patterns.similarity_threshold": "yaml",
    "failure_patterns.min_occurrences": "yaml",
    "contract_first.enabled": "yaml",
    "contract_first.require_for": "yaml",
    "contract_first.allow_natural_for": "yaml",
    "output.externalize_lines": "yaml",
    "output.externalize_tokens": "yaml",
    "output.request_max_lines": "yaml",
    "output.diff_split_lines": "yaml",
    "log.tail_lines": "yaml",
    "log.line_max_chars": "yaml",
    "log.rotation_time_utc": "yaml",
    "log.dual_format_daily": "yaml",
    "log.compress_after_days": "yaml",
    "log.monthly_after_days": "yaml",
    "log.quarterly_after_days": "yaml",
    "log.report_delay_hours": "yaml",
    "log.structured_wal": "yaml",
    "retention.output_keep_days": "yaml",
    "retention.output_archive_days": "yaml",
    "retention.log_keep_days": "yaml",
    "retention.daily_log_days": "yaml",
    "retention.monthly_summary_days": "yaml",
    "retention.quarterly_archive_days": "yaml",
    "retention.config_history_keep": "yaml",
    "retention.approval_keep_days": "yaml",
    "retention.merge_history_days": "yaml",
    "retention.failure_audit_days": "yaml",
    "retention.metrics_days": "yaml",
    "retention.status_metrics_days": "yaml",
    "retention.idempotency_days": "yaml",
    "limits.dep_chain_warn": "yaml",
    "limits.dep_chain_halt": "yaml",
    "limits.comments_keep": "yaml",
    "limits.history_max_lines": "yaml",
    "limits.pending_stale_days": "yaml",
    "limits.stale_block_days": "yaml",
    "limits.blocker_fatigue_count": "yaml",
    "limits.approval_delete_files": "yaml",
    "limits.approval_issue_count": "yaml",
    "limits.similarity_threshold": "yaml",
    "limits.ac_change_blocker_pct": "yaml",
    "limits.analysis_max_per_day": "yaml",
    "limits.issue_granularity.max_acs": "yaml",
    "limits.issue_granularity.max_files": "yaml",
    "limits.issue_granularity.max_diff_lines": "yaml",
    "limits.issue_granularity.warn_only": "yaml",
    "priority.human_override_max": "yaml",
    "priority.boost_value": "yaml",
    "priority.starvation_warn_hours": "yaml",